{
  "schema_version": 1,
  "book_id": "harbinger-vol-1-omega-rising",
  "source_sha256": "69975ea54b0a0d047a64151a22a2338fc1c330b51f7c2691b5f214ddce7cb979",
  "pages": [
    {
      "page_id": "p-69975ea54b0a0d047a64151a22a2338fc1c330b51f7c2691b5f214ddce7cb979-0011",
      "pdf_page_number": 11,
      "added_regions": [
        {
          "id": "ref-h-011-01",
          "x": 0.057692307692307696,
          "y": 0.035833333333333335,
          "width": 0.8846153846153846,
          "height": 0.31916666666666665
        },
        {
          "id": "ref-h-011-02",
          "x": 0.057692307692307696,
          "y": 0.36916666666666664,
          "width": 0.8846153846153846,
          "height": 0.1908333333333334
        },
        {
          "id": "ref-h-011-03",
          "x": 0.057692307692307696,
          "y": 0.5733333333333334,
          "width": 0.8846153846153846,
          "height": 0.39083333333333325
        }
      ],
      "edited_regions": [],
      "deleted_region_ids": [],
      "order": [
        "ref-h-011-01",
        "ref-h-011-02",
        "ref-h-011-03"
      ]
    },
    {
      "page_id": "p-69975ea54b0a0d047a64151a22a2338fc1c330b51f7c2691b5f214ddce7cb979-0023",
      "pdf_page_number": 23,
      "added_regions": [
        {
          "id": "ref-h-023-01",
          "x": 0.0,
          "y": 0.0,
          "width": 0.4153846153846154,
          "height": 0.23083333333333333
        },
        {
          "id": "ref-h-023-02",
          "x": 0.33974358974358976,
          "y": 0.05416666666666667,
          "width": 0.6217948717948718,
          "height": 0.18
        },
        {
          "id": "ref-h-023-03",
          "x": 0.052564102564102565,
          "y": 0.23916666666666667,
          "width": 0.2923076923076923,
          "height": 0.265
        },
        {
          "id": "ref-h-023-04",
          "x": 0.3576923076923077,
          "y": 0.23916666666666667,
          "width": 0.2705128205128205,
          "height": 0.265
        },
        {
          "id": "ref-h-023-05",
          "x": 0.6410256410256411,
          "y": 0.23916666666666667,
          "width": 0.3025641025641025,
          "height": 0.265
        },
        {
          "id": "ref-h-023-06",
          "x": 0.052564102564102565,
          "y": 0.5108333333333334,
          "width": 0.6551282051282051,
          "height": 0.16499999999999992
        },
        {
          "id": "ref-h-023-07",
          "x": 0.6641025641025641,
          "y": 0.5916666666666667,
          "width": 0.3358974358974359,
          "height": 0.4083333333333333
        },
        {
          "id": "ref-h-023-08",
          "x": 0.10897435897435898,
          "y": 0.6808333333333333,
          "width": 0.6217948717948718,
          "height": 0.2633333333333334
        }
      ],
      "edited_regions": [],
      "deleted_region_ids": [],
      "order": [
        "ref-h-023-01",
        "ref-h-023-02",
        "ref-h-023-03",
        "ref-h-023-04",
        "ref-h-023-05",
        "ref-h-023-06",
        "ref-h-023-07",
        "ref-h-023-08"
      ]
    },
    {
      "page_id": "p-69975ea54b0a0d047a64151a22a2338fc1c330b51f7c2691b5f214ddce7cb979-0034",
      "pdf_page_number": 34,
      "added_regions": [
        {
          "id": "ref-h-034-01",
          "x": 0.1375796178343949,
          "y": 0.08416666666666667,
          "width": 0.2955414012738854,
          "height": 0.3375
        },
        {
          "id": "ref-h-034-02",
          "x": 0.4496815286624204,
          "y": 0.08416666666666667,
          "width": 0.46114649681528663,
          "height": 0.16749999999999998
        },
        {
          "id": "ref-h-034-03",
          "x": 0.4496815286624204,
          "y": 0.2608333333333333,
          "width": 0.46114649681528663,
          "height": 0.16083333333333338
        },
        {
          "id": "ref-h-034-04",
          "x": 0.1375796178343949,
          "y": 0.43083333333333335,
          "width": 0.7732484076433122,
          "height": 0.16083333333333333
        },
        {
          "id": "ref-h-034-05",
          "x": 0.1375796178343949,
          "y": 0.6008333333333333,
          "width": 0.7732484076433122,
          "height": 0.15500000000000003
        },
        {
          "id": "ref-h-034-06",
          "x": 0.1375796178343949,
          "y": 0.7675,
          "width": 0.7732484076433122,
          "height": 0.17666666666666675
        }
      ],
      "edited_regions": [],
      "deleted_region_ids": [],
      "order": [
        "ref-h-034-01",
        "ref-h-034-02",
        "ref-h-034-03",
        "ref-h-034-04",
        "ref-h-034-05",
        "ref-h-034-06"
      ]
    },
    {
      "page_id": "p-69975ea54b0a0d047a64151a22a2338fc1c330b51f7c2691b5f214ddce7cb979-0044",
      "pdf_page_number": 44,
      "added_regions": [
        {
          "id": "ref-h-044-01",
          "x": 0.05641025641025641,
          "y": 0.034166666666666665,
          "width": 0.8858974358974359,
          "height": 0.22499999999999998
        },
        {
          "id": "ref-h-044-02",
          "x": 0.05641025641025641,
          "y": 0.2658333333333333,
          "width": 0.8858974358974359,
          "height": 0.14083333333333337
        },
        {
          "id": "ref-h-044-03",
          "x": 0.05641025641025641,
          "y": 0.4141666666666667,
          "width": 0.8858974358974359,
          "height": 0.14
        },
        {
          "id": "ref-h-044-04",
          "x": 0.05641025641025641,
          "y": 0.5608333333333333,
          "width": 0.8858974358974359,
          "height": 0.18333333333333335
        },
        {
          "id": "ref-h-044-05",
          "x": 0.05641025641025641,
          "y": 0.7516666666666667,
          "width": 0.8858974358974359,
          "height": 0.21083333333333332
        }
      ],
      "edited_regions": [],
      "deleted_region_ids": [],
      "order": [
        "ref-h-044-01",
        "ref-h-044-02",
        "ref-h-044-03",
        "ref-h-044-04",
        "ref-h-044-05"
      ]
    },
    {
      "page_id": "p-69975ea54b0a0d047a64151a22a2338fc1c330b51f7c2691b5f214ddce7cb979-0058",
      "pdf_page_number": 58,
      "added_regions": [
        {
          "id": "ref-h-058-01",
          "x": 0.05512820512820513,
          "y": 0.035833333333333335,
          "width": 0.27179487179487183,
          "height": 0.30583333333333335
        },
        {
          "id": "ref-h-058-02",
          "x": 0.33589743589743587,
          "y": 0.035,
          "width": 0.6076923076923078,
          "height": 0.30666666666666664
        },
        {
          "id": "ref-h-058-03",
          "x": 0.05512820512820513,
          "y": 0.3491666666666667,
          "width": 0.27179487179487183,
          "height": 0.3541666666666667
        },
        {
          "id": "ref-h-058-04",
          "x": 0.33589743589743587,
          "y": 0.34833333333333333,
          "width": 0.27435897435897444,
          "height": 0.35500000000000004
        },
        {
          "id": "ref-h-058-05",
          "x": 0.6192307692307693,
          "y": 0.34833333333333333,
          "width": 0.3243589743589743,
          "height": 0.35500000000000004
        },
        {
          "id": "ref-h-058-06",
          "x": 0.05512820512820513,
          "y": 0.71,
          "width": 0.8884615384615384,
          "height": 0.255
        }
      ],
      "edited_regions": [],
      "deleted_region_ids": [],
      "order": [
        "ref-h-058-01",
        "ref-h-058-02",
        "ref-h-058-03",
        "ref-h-058-04",
        "ref-h-058-05",
        "ref-h-058-06"
      ]
    },
    {
      "page_id": "p-69975ea54b0a0d047a64151a22a2338fc1c330b51f7c2691b5f214ddce7cb979-0141",
      "pdf_page_number": 141,
      "added_regions": [
        {
          "id": "ref-h-141-01",
          "x": 0.05333333333333334,
          "y": 0.0314192849404117,
          "width": 0.13833333333333334,
          "height": 0.38353196099674974
        },
        {
          "id": "ref-h-141-02",
          "x": 0.16166666666666665,
          "y": 0.12134344528710726,
          "width": 0.16583333333333336,
          "height": 0.380281690140845
        },
        {
          "id": "ref-h-141-03",
          "x": 0.0525,
          "y": 0.02925243770314193,
          "width": 0.8983333333333333,
          "height": 0.9404117009750813
        },
        {
          "id": "ref-h-141-04",
          "x": 0.6491666666666667,
          "y": 0.5222101841820151,
          "width": 0.16666666666666663,
          "height": 0.3531960996749729
        },
        {
          "id": "ref-h-141-05",
          "x": 0.8041666666666667,
          "y": 0.5828819068255688,
          "width": 0.15999999999999992,
          "height": 0.3846153846153846
        }
      ],
      "edited_regions": [],
      "deleted_region_ids": [],
      "order": [
        "ref-h-141-01",
        "ref-h-141-02",
        "ref-h-141-03",
        "ref-h-141-04",
        "ref-h-141-05"
      ]
    }
  ]
}
