{
  "schema_version": 1,
  "book_id": "archer-armstrong-vol-1-the-michelangelo-code",
  "source_sha256": "53ef05d949a1e0c98472e19008ce052214dc4b4c776d1f87aeb8fe720ae1222a",
  "pages": [
    {
      "page_id": "p-53ef05d949a1e0c98472e19008ce052214dc4b4c776d1f87aeb8fe720ae1222a-0007",
      "pdf_page_number": 7,
      "added_regions": [
        {
          "id": "ref-a-007-01",
          "x": 0.05897435897435897,
          "y": 0.049166666666666664,
          "width": 0.891025641025641,
          "height": 0.16083333333333333
        },
        {
          "id": "ref-a-007-02",
          "x": 0.05897435897435897,
          "y": 0.21416666666666667,
          "width": 0.8897435897435897,
          "height": 0.21166666666666667
        },
        {
          "id": "ref-a-007-03",
          "x": 0.05897435897435897,
          "y": 0.43,
          "width": 0.8897435897435897,
          "height": 0.14916666666666673
        },
        {
          "id": "ref-a-007-04",
          "x": 0.05897435897435897,
          "y": 0.5808333333333333,
          "width": 0.8897435897435897,
          "height": 0.17000000000000004
        },
        {
          "id": "ref-a-007-05",
          "x": 0.057692307692307696,
          "y": 0.7541666666666667,
          "width": 0.891025641025641,
          "height": 0.1975
        }
      ],
      "edited_regions": [],
      "deleted_region_ids": [],
      "order": [
        "ref-a-007-01",
        "ref-a-007-02",
        "ref-a-007-03",
        "ref-a-007-04",
        "ref-a-007-05"
      ]
    },
    {
      "page_id": "p-53ef05d949a1e0c98472e19008ce052214dc4b4c776d1f87aeb8fe720ae1222a-0010",
      "pdf_page_number": 10,
      "added_regions": [
        {
          "id": "ref-a-010-01",
          "x": 0.06282051282051282,
          "y": 0.060833333333333336,
          "width": 0.8641025641025641,
          "height": 0.20416666666666666
        },
        {
          "id": "ref-a-010-02",
          "x": 0.0,
          "y": 0.2675,
          "width": 1.0,
          "height": 0.2608333333333333
        },
        {
          "id": "ref-a-010-03",
          "x": 0.05897435897435897,
          "y": 0.5308333333333334,
          "width": 0.2512820512820513,
          "height": 0.39249999999999996
        },
        {
          "id": "ref-a-010-04",
          "x": 0.308974358974359,
          "y": 0.5283333333333333,
          "width": 0.691025641025641,
          "height": 0.26250000000000007
        },
        {
          "id": "ref-a-010-05",
          "x": 0.4269230769230769,
          "y": 0.8275,
          "width": 0.573076923076923,
          "height": 0.1266666666666667
        }
      ],
      "edited_regions": [],
      "deleted_region_ids": [],
      "order": [
        "ref-a-010-01",
        "ref-a-010-02",
        "ref-a-010-03",
        "ref-a-010-04",
        "ref-a-010-05"
      ]
    },
    {
      "page_id": "p-53ef05d949a1e0c98472e19008ce052214dc4b4c776d1f87aeb8fe720ae1222a-0017",
      "pdf_page_number": 17,
      "added_regions": [
        {
          "id": "ref-a-017-01",
          "x": 0.05128205128205128,
          "y": 0.04833333333333333,
          "width": 0.3,
          "height": 0.2833333333333333
        },
        {
          "id": "ref-a-017-02",
          "x": 0.35512820512820514,
          "y": 0.04833333333333333,
          "width": 0.2987179487179487,
          "height": 0.2841666666666667
        },
        {
          "id": "ref-a-017-03",
          "x": 0.6564102564102564,
          "y": 0.04,
          "width": 0.30641025641025643,
          "height": 0.29250000000000004
        },
        {
          "id": "ref-a-017-04",
          "x": 0.014102564102564103,
          "y": 0.3375,
          "width": 0.9730769230769232,
          "height": 0.38583333333333336
        },
        {
          "id": "ref-a-017-05",
          "x": 0.05,
          "y": 0.7241666666666666,
          "width": 0.7435897435897435,
          "height": 0.23250000000000004
        },
        {
          "id": "ref-a-017-06",
          "x": 0.8192307692307692,
          "y": 0.725,
          "width": 0.1346153846153847,
          "height": 0.21916666666666673
        }
      ],
      "edited_regions": [],
      "deleted_region_ids": [],
      "order": [
        "ref-a-017-01",
        "ref-a-017-02",
        "ref-a-017-03",
        "ref-a-017-04",
        "ref-a-017-05",
        "ref-a-017-06"
      ]
    },
    {
      "page_id": "p-53ef05d949a1e0c98472e19008ce052214dc4b4c776d1f87aeb8fe720ae1222a-0033",
      "pdf_page_number": 33,
      "added_regions": [
        {
          "id": "ref-a-033-01",
          "x": 0.04358974358974359,
          "y": 0.04083333333333333,
          "width": 0.9102564102564104,
          "height": 0.17166666666666666
        },
        {
          "id": "ref-a-033-02",
          "x": 0.04358974358974359,
          "y": 0.2175,
          "width": 0.28076923076923077,
          "height": 0.5408333333333333
        },
        {
          "id": "ref-a-033-03",
          "x": 0.3282051282051282,
          "y": 0.21666666666666667,
          "width": 0.3641025641025641,
          "height": 0.5416666666666666
        },
        {
          "id": "ref-a-033-04",
          "x": 0.6948717948717948,
          "y": 0.21583333333333332,
          "width": 0.267948717948718,
          "height": 0.29333333333333333
        },
        {
          "id": "ref-a-033-05",
          "x": 0.6948717948717948,
          "y": 0.43666666666666665,
          "width": 0.26025641025641033,
          "height": 0.32166666666666666
        },
        {
          "id": "ref-a-033-06",
          "x": 0.046153846153846156,
          "y": 0.7608333333333334,
          "width": 0.9102564102564104,
          "height": 0.2041666666666666
        }
      ],
      "edited_regions": [],
      "deleted_region_ids": [],
      "order": [
        "ref-a-033-01",
        "ref-a-033-02",
        "ref-a-033-03",
        "ref-a-033-04",
        "ref-a-033-05",
        "ref-a-033-06"
      ]
    },
    {
      "page_id": "p-53ef05d949a1e0c98472e19008ce052214dc4b4c776d1f87aeb8fe720ae1222a-0049",
      "pdf_page_number": 49,
      "added_regions": [
        {
          "id": "ref-a-049-01",
          "x": 0.03717948717948718,
          "y": 0.04083333333333333,
          "width": 0.24615384615384614,
          "height": 0.9216666666666666
        },
        {
          "id": "ref-a-049-02",
          "x": 0.27564102564102566,
          "y": 0.22416666666666665,
          "width": 0.2730769230769231,
          "height": 0.7375
        },
        {
          "id": "ref-a-049-03",
          "x": 0.5205128205128206,
          "y": 0.36333333333333334,
          "width": 0.21923076923076923,
          "height": 0.5983333333333334
        },
        {
          "id": "ref-a-049-04",
          "x": 0.7346153846153847,
          "y": 0.4775,
          "width": 0.22179487179487178,
          "height": 0.4841666666666667
        }
      ],
      "edited_regions": [],
      "deleted_region_ids": [],
      "order": [
        "ref-a-049-01",
        "ref-a-049-02",
        "ref-a-049-03",
        "ref-a-049-04"
      ]
    },
    {
      "page_id": "p-53ef05d949a1e0c98472e19008ce052214dc4b4c776d1f87aeb8fe720ae1222a-0067",
      "pdf_page_number": 67,
      "added_regions": [
        {
          "id": "ref-a-067-01",
          "x": 0.038461538461538464,
          "y": 0.04083333333333333,
          "width": 0.2948717948717948,
          "height": 0.30416666666666664
        },
        {
          "id": "ref-a-067-02",
          "x": 0.3384615384615385,
          "y": 0.04,
          "width": 0.30512820512820515,
          "height": 0.3041666666666667
        },
        {
          "id": "ref-a-067-03",
          "x": 0.6487179487179487,
          "y": 0.0375,
          "width": 0.29871794871794866,
          "height": 0.30500000000000005
        },
        {
          "id": "ref-a-067-04",
          "x": 0.041025641025641026,
          "y": 0.34833333333333333,
          "width": 0.29615384615384616,
          "height": 0.30250000000000005
        },
        {
          "id": "ref-a-067-05",
          "x": 0.34102564102564104,
          "y": 0.3475,
          "width": 0.3076923076923077,
          "height": 0.30083333333333334
        },
        {
          "id": "ref-a-067-06",
          "x": 0.6525641025641026,
          "y": 0.3466666666666667,
          "width": 0.2961538461538461,
          "height": 0.29999999999999993
        },
        {
          "id": "ref-a-067-07",
          "x": 0.04487179487179487,
          "y": 0.6541666666666667,
          "width": 0.29615384615384616,
          "height": 0.3075
        },
        {
          "id": "ref-a-067-08",
          "x": 0.34487179487179487,
          "y": 0.6525,
          "width": 0.308974358974359,
          "height": 0.30833333333333335
        },
        {
          "id": "ref-a-067-09",
          "x": 0.6564102564102564,
          "y": 0.6508333333333334,
          "width": 0.2974358974358975,
          "height": 0.3075
        }
      ],
      "edited_regions": [],
      "deleted_region_ids": [],
      "order": [
        "ref-a-067-01",
        "ref-a-067-02",
        "ref-a-067-03",
        "ref-a-067-04",
        "ref-a-067-05",
        "ref-a-067-06",
        "ref-a-067-07",
        "ref-a-067-08",
        "ref-a-067-09"
      ]
    }
  ]
}
