{
  "schema_version": 1,
  "book_id": "quantum-and-woody-vol-1-the-worlds-worst-superhero-team",
  "source_sha256": "2c10cfe55eac42984025e7e86ed4c9c3d78e3a4a22219fbedda0862ab9b8dd71",
  "pages": [
    {
      "page_id": "p-2c10cfe55eac42984025e7e86ed4c9c3d78e3a4a22219fbedda0862ab9b8dd71-0010",
      "pdf_page_number": 10,
      "added_regions": [
        {
          "id": "ref-q-010-01",
          "x": 0.021794871794871794,
          "y": 0.015,
          "width": 0.9551282051282051,
          "height": 0.15000000000000002
        },
        {
          "id": "ref-q-010-02",
          "x": 0.021794871794871794,
          "y": 0.17166666666666666,
          "width": 0.9551282051282051,
          "height": 0.05916666666666667
        },
        {
          "id": "ref-q-010-03",
          "x": 0.020512820512820513,
          "y": 0.23833333333333334,
          "width": 0.2871794871794872,
          "height": 0.24916666666666665
        },
        {
          "id": "ref-q-010-04",
          "x": 0.32051282051282054,
          "y": 0.23833333333333334,
          "width": 0.27307692307692305,
          "height": 0.24916666666666665
        },
        {
          "id": "ref-q-010-05",
          "x": 0.6076923076923076,
          "y": 0.23833333333333334,
          "width": 0.36923076923076925,
          "height": 0.24916666666666665
        },
        {
          "id": "ref-q-010-06",
          "x": 0.019230769230769232,
          "y": 0.49416666666666664,
          "width": 0.46153846153846156,
          "height": 0.2825
        },
        {
          "id": "ref-q-010-07",
          "x": 0.4948717948717949,
          "y": 0.495,
          "width": 0.4807692307692307,
          "height": 0.2816666666666666
        },
        {
          "id": "ref-q-010-08",
          "x": 0.019230769230769232,
          "y": 0.7833333333333333,
          "width": 0.9564102564102563,
          "height": 0.19666666666666666
        }
      ],
      "edited_regions": [],
      "deleted_region_ids": [],
      "order": [
        "ref-q-010-01",
        "ref-q-010-02",
        "ref-q-010-03",
        "ref-q-010-04",
        "ref-q-010-05",
        "ref-q-010-06",
        "ref-q-010-07",
        "ref-q-010-08"
      ]
    },
    {
      "page_id": "p-2c10cfe55eac42984025e7e86ed4c9c3d78e3a4a22219fbedda0862ab9b8dd71-0012",
      "pdf_page_number": 12,
      "added_regions": [
        {
          "id": "ref-q-012-01",
          "x": 0.015384615384615385,
          "y": 0.011666666666666667,
          "width": 0.964102564102564,
          "height": 0.2125
        },
        {
          "id": "ref-q-012-02",
          "x": 0.014102564102564103,
          "y": 0.23083333333333333,
          "width": 0.6423076923076924,
          "height": 0.4341666666666667
        },
        {
          "id": "ref-q-012-03",
          "x": 0.6717948717948717,
          "y": 0.23083333333333333,
          "width": 0.30641025641025643,
          "height": 0.22583333333333333
        },
        {
          "id": "ref-q-012-04",
          "x": 0.6705128205128205,
          "y": 0.46416666666666667,
          "width": 0.3076923076923077,
          "height": 0.20166666666666672
        },
        {
          "id": "ref-q-012-05",
          "x": 0.01282051282051282,
          "y": 0.6733333333333333,
          "width": 0.9653846153846154,
          "height": 0.15666666666666662
        },
        {
          "id": "ref-q-012-06",
          "x": 0.011538461538461539,
          "y": 0.8383333333333334,
          "width": 0.9641025641025641,
          "height": 0.1449999999999999
        }
      ],
      "edited_regions": [],
      "deleted_region_ids": [],
      "order": [
        "ref-q-012-01",
        "ref-q-012-02",
        "ref-q-012-03",
        "ref-q-012-04",
        "ref-q-012-05",
        "ref-q-012-06"
      ]
    },
    {
      "page_id": "p-2c10cfe55eac42984025e7e86ed4c9c3d78e3a4a22219fbedda0862ab9b8dd71-0020",
      "pdf_page_number": 20,
      "added_regions": [
        {
          "id": "ref-q-020-01",
          "x": 0.028205128205128206,
          "y": 0.034166666666666665,
          "width": 0.4653846153846154,
          "height": 0.21000000000000002
        },
        {
          "id": "ref-q-020-02",
          "x": 0.5051282051282051,
          "y": 0.034166666666666665,
          "width": 0.458974358974359,
          "height": 0.21000000000000002
        },
        {
          "id": "ref-q-020-03",
          "x": 0.02564102564102564,
          "y": 0.24833333333333332,
          "width": 0.3551282051282051,
          "height": 0.2633333333333334
        },
        {
          "id": "ref-q-020-04",
          "x": 0.391025641025641,
          "y": 0.24833333333333332,
          "width": 0.573076923076923,
          "height": 0.2633333333333334
        },
        {
          "id": "ref-q-020-05",
          "x": 0.026923076923076925,
          "y": 0.5175,
          "width": 0.2987179487179487,
          "height": 0.2250000000000001
        },
        {
          "id": "ref-q-020-06",
          "x": 0.3371794871794872,
          "y": 0.5166666666666667,
          "width": 0.28205128205128205,
          "height": 0.22583333333333333
        },
        {
          "id": "ref-q-020-07",
          "x": 0.6294871794871795,
          "y": 0.5166666666666667,
          "width": 0.33461538461538465,
          "height": 0.22583333333333333
        },
        {
          "id": "ref-q-020-08",
          "x": 0.023076923076923078,
          "y": 0.7483333333333333,
          "width": 0.3025641025641026,
          "height": 0.22083333333333333
        },
        {
          "id": "ref-q-020-09",
          "x": 0.33589743589743587,
          "y": 0.7483333333333333,
          "width": 0.2833333333333334,
          "height": 0.22083333333333333
        },
        {
          "id": "ref-q-020-10",
          "x": 0.6294871794871795,
          "y": 0.7483333333333333,
          "width": 0.33461538461538465,
          "height": 0.22166666666666668
        }
      ],
      "edited_regions": [],
      "deleted_region_ids": [],
      "order": [
        "ref-q-020-01",
        "ref-q-020-02",
        "ref-q-020-03",
        "ref-q-020-04",
        "ref-q-020-05",
        "ref-q-020-06",
        "ref-q-020-07",
        "ref-q-020-08",
        "ref-q-020-09",
        "ref-q-020-10"
      ]
    },
    {
      "page_id": "p-2c10cfe55eac42984025e7e86ed4c9c3d78e3a4a22219fbedda0862ab9b8dd71-0029",
      "pdf_page_number": 29,
      "added_regions": [
        {
          "id": "ref-q-029-01",
          "x": 0.04358974358974359,
          "y": 0.025833333333333333,
          "width": 0.46538461538461534,
          "height": 0.35333333333333333
        },
        {
          "id": "ref-q-029-02",
          "x": 0.517948717948718,
          "y": 0.025833333333333333,
          "width": 0.46153846153846145,
          "height": 0.3541666666666667
        },
        {
          "id": "ref-q-029-03",
          "x": 0.03974358974358974,
          "y": 0.38416666666666666,
          "width": 0.4871794871794872,
          "height": 0.59
        },
        {
          "id": "ref-q-029-04",
          "x": 0.4461538461538462,
          "y": 0.38416666666666666,
          "width": 0.5320512820512819,
          "height": 0.18666666666666665
        },
        {
          "id": "ref-q-029-05",
          "x": 0.4461538461538462,
          "y": 0.5758333333333333,
          "width": 0.5294871794871794,
          "height": 0.19333333333333336
        },
        {
          "id": "ref-q-029-06",
          "x": 0.5282051282051282,
          "y": 0.7758333333333334,
          "width": 0.4461538461538461,
          "height": 0.17583333333333329
        }
      ],
      "edited_regions": [],
      "deleted_region_ids": [],
      "order": [
        "ref-q-029-01",
        "ref-q-029-02",
        "ref-q-029-03",
        "ref-q-029-04",
        "ref-q-029-05",
        "ref-q-029-06"
      ]
    },
    {
      "page_id": "p-2c10cfe55eac42984025e7e86ed4c9c3d78e3a4a22219fbedda0862ab9b8dd71-0031",
      "pdf_page_number": 31,
      "added_regions": [
        {
          "id": "ref-q-031-01",
          "x": 0.046153846153846156,
          "y": 0.04,
          "width": 0.9076923076923078,
          "height": 0.9241666666666666
        }
      ],
      "edited_regions": [],
      "deleted_region_ids": [],
      "order": [
        "ref-q-031-01"
      ]
    },
    {
      "page_id": "p-2c10cfe55eac42984025e7e86ed4c9c3d78e3a4a22219fbedda0862ab9b8dd71-0037",
      "pdf_page_number": 37,
      "added_regions": [
        {
          "id": "ref-q-037-01",
          "x": 0.02564102564102564,
          "y": 0.019166666666666665,
          "width": 0.4564102564102564,
          "height": 0.2941666666666667
        },
        {
          "id": "ref-q-037-02",
          "x": 0.4935897435897436,
          "y": 0.019166666666666665,
          "width": 0.48589743589743584,
          "height": 0.295
        },
        {
          "id": "ref-q-037-03",
          "x": 0.023076923076923078,
          "y": 0.32,
          "width": 0.9564102564102563,
          "height": 0.32416666666666666
        },
        {
          "id": "ref-q-037-04",
          "x": 0.023076923076923078,
          "y": 0.6491666666666667,
          "width": 0.47307692307692306,
          "height": 0.3325
        },
        {
          "id": "ref-q-037-05",
          "x": 0.5064102564102564,
          "y": 0.65,
          "width": 0.4705128205128205,
          "height": 0.3325
        }
      ],
      "edited_regions": [],
      "deleted_region_ids": [],
      "order": [
        "ref-q-037-01",
        "ref-q-037-02",
        "ref-q-037-03",
        "ref-q-037-04",
        "ref-q-037-05"
      ]
    }
  ]
}
